A1: 山东理工大学首届ACM程序设计竞赛获奖名单
A2: 1 | B2: 7 | C2: 0712102254 | D2: 于龙 | E2: 一等奖 8人 3% | F2: 计科0704 | G2: 计算机科学与技术学院
A3: 2 | B3: 7 | C3: 0632107974 | D3: 颜征 | F3: 计科0601 | G3: 计算机科学与技术学院
A4: 3 | B4: 5 | C4: 0712101506 | D4: 曹政 | F4: 计科0704 | G4: 计算机科学与技术学院
A5: 4 | B5: 5 | C5: 0612101027 | D5: 张贤佳 | F5: 计科0602 | G5: 计算机科学与技术学院
A6: 5 | B6: 5 | C6: 0712103742 | D6: 单洪明 | F6: 信科0702 | G6: 理学院
A7: 6 | B7: 5 | C7: 0712102644 | D7: 张宇 | F7: 机设0702 | G7: 机械工程学院
A8: 7 | B8: 5 | C8: 0612104218 | D8: 王帅 | F8: 热能0603 | G8: 交通与车辆工程学院
A9: 8 | B9: 5 | C9: 0712105759 | D9: 韩鎏 | F9: 机制0704 | G9: 机械工程学院
A10: 9 | B10: 4 | C10: 0612102440 | D10: 孟庆田 | E10: 二等奖 16人 6% | F10: 计科0602 | G10: 计算机科学与技术学院
A11: 10 | B11: 4 | C11: 0712100657 | D11: 徐向远 | F11: 车辆0703 | G11: 交通与车辆工程学院
A12: 11 | B12: 4 | C12: 0612109001 | D12: 田晓宇 | F12: 计科0601 | G12: 计算机科学与技术学院
A13: 12 | B13: 4 | C13: 0612103055 | D13: 尚国鹏 | F13: 信科0601 | G13: 理学院
A14: 13 | B14: 4 | C14: 0612100491 | D14: 王猛 | F14: 计科0604 | G14: 计算机科学与技术学院
A15: 14 | B15: 4 | C15: 0812106205 | D15: 李亚舟 | F15: 理本08103 | G15: 一年级工作部
A16: 15 | B16: 4 | C16: 0612204126 | D16: 徐慧慧 | F16: 信科0601 | G16: 理学院
A17: 16 | B17: 4 | C17: 0712100234 | D17: 刘东亮 | F17: 计科0704 | G17: 计算机科学与技术学院
A18: 17 | B18: 4 | C18: 0712100277 | D18: 李翔 | F18: 计科0704 | G18: 计算机科学与技术学院
A19: 18 | B19: 4 | C19: 0712103855 | D19: 马兆健 | F19: 机电0702 | G19: 机械工程学院
A20: 19 | B20: 4 | C20: 0812102554 | D20: 陈强 | F20: 理本0832 | G20: 一年级工作部
A21: 20 | B21: 4 | C21: 0712103269 | D21: 解西扬 | F21: 计科0704 | G21: 计算机科学与技术学院
A22: 21 | B22: 4 | C22: 0612103779 | D22: 赵志洋 | F22: 信科0602 | G22: 理学院
A23: 22 | B23: 4 | C23: 0712103099 | D23: 刘井年 | F23: 机设0702 | G23: 机械工程学院
A24: 23 | B24: 4 | C24: 0612200025 | D24: 李小娜 | F24: 信科0602 | G24: 理学院
A25: 24 | B25: 4 | C25: 0712104962 | D25: 姚洪民 | F25: 机设0702 | G25: 机械工程学院
A26: 25 | B26: 3 | C26: 0712103114 | D26: 杨廷超 | E26: 三等奖 19人 7% | F26: 计科0704 | G26: 计算机科学与技术学院
A27: 26 | B27: 3 | C27: 0712101468 | D27: 张明星 | F27: 计科0704 | G27: 计算机科学与技术学院
A28: 27 | B28: 3 | C28: 0712105003 | D28: 谢柯 | F28: 计科0704 | G28: 计算机科学与技术学院
A29: 28 | B29: 3 | C29: 0612104554 | D29: 张立佩 | F29: 电气0603 | G29: 电气与电子工程学院
A30: 29 | B30: 3 | C30: 0711100768 | D30: 崔貌 | F30: 热能0701 | G30: 交通与车辆工程学院
A31: 30 | B31: 3 | C31: 0612106319 | D31: 沓世勤 | F31: 通信0601 | G31: 计算机科学与技术学院
A32: 31 | B32: 3 | C32: 0712103052 | D32: 李自淼 | F32: 机制0705 | G32: 机械工程学院
A33: 32 | B33: 3 | C33: 0612104114 | D33: 米爱武 | F33: 信科0601 | G33: 理学院
A34: 33 | B34: 3 | C34: 0612104776 | D34: 王振华 | F34: 信科0602 | G34: 理学院
A35: 34 | B35: 3 | C35: 0712105119 | D35: 范青海 | F35: 机电0701 | G35: 机械工程学院
A36: 35 | B36: 3 | C36: 0712103321 | D36: 陈公伟 | F36: 计科0701 | G36: 计算机科学与技术学院
A37: 36 | B37: 3 | C37: 0612104471 | D37: 薛鹏飞 | F37: 信科0601 | G37: 理学院
A38: 37 | B38: 3 | C38: 0712203722 | D38: 陈祥芹 | F38: 车辆0702 | G38: 交通与车辆工程学院
A39: 38 | B39: 3 | C39: 0712106422 | D39: 鄢志雄 | F39: 材料0702 | G39: 机械工程学院
A40: 39 | B40: 3 | C40: 0612103664 | D40: 王志刚 | F40: 信科0601 | G40: 理学院
A41: 40 | B41: 3 | C41: 0812107768 | D41: 刘坤 | F41: 国防0802 | G41: 电气与电子工程学院
A42: 41 | B42: 3 | C42: 0712103009 | D42: 李鹏鹏 | F42: 机制0705 | G42: 机械工程学院
A43: 42 | B43: 3 | C43: 0712104091 | D43: 张自海 | F43: 机电0702 | G43: 机械工程学院
A44: 43 | B44: 3 | C44: 0712202377 | D44: 于平 | F44: 信科0702 | G44: 理学院
A45: 44 | B45: 2 | C45: 0712104889 | D45: 刘晨 | E45: 优胜奖 45人 | F45: 电信0703 | G45: 电气与电子工程学院
A46: 45 | B46: 2 | C46: 0612204799 | D46: 杨超凡 | F46: 电科0601 | G46: 电气与电子工程学院
A47: 46 | B47: 2 | C47: 0712102730 | D47: 张中亮 | F47: 车辆0701 | G47: 交通与车辆工程学院
A48: 47 | B48: 2 | C48: 0612204377 | D48: 麻兴梅 | F48: 计科0601 | G48: 计算机科学与技术学院
A49: 48 | B49: 2 | C49: 0712104695 | D49: 姚德鹏 | F49: 计科0704 | G49: 计算机科学与技术学院
A50: 49 | B50: 2 | C50: 0712101846 | D50: 程荣凯 | F50: 机电0702 | G50: 机械工程学院
A51: 50 | B51: 2 | C51: 0612102755 | D51: 陈存 | F51: 电气0601 | G51: 电气与电子工程学院
A52: 51 | B52: 2 | C52: 0712104195 | D52: 姜文祥 | F52: 计科0704 | G52: 计算机科学与技术学院
A53: 52 | B53: 2 | C53: 0712104977 | D53: 许永攀 | F53: 机电0702 | G53: 机械工程学院
A54: 53 | B54: 2 | C54: 0712104655 | D54: 万吉奎 | F54: 车辆0701 | G54: 交通与车辆工程学院
A55: 54 | B55: 2 | C55: 0712104995 | D55: 周广敬 | F55: 材料0702 | G55: 机械工程学院
A56: 55 | B56: 2 | C56: 0812107476 | D56: 张智玉 | F56: 理本08113 | G56: 一年级工作部
A57: 56 | B57: 2 | C57: 0712105054 | D57: 刘纪祥 | F57: 车辆0704 | G57: 交通与车辆工程学院
A58: 57 | B58: 2 | C58: 0712104929 | D58: 田昌进 | F58: 计科0704 | G58: 计算机科学与技术学院
A59: 58 | B59: 2 | C59: 0712205961 | D59: 袁倩 | F59: 会计0702 | G59: 管理学院
A60: 59 | B60: 2 | C60: 0712103723 | D60: 于长广 | F60: 机制0705 | G60: 机械工程学院
A61: 60 | B61: 2 | C61: 0712103794 | D61: 张德元 | F61: 计科0704 | G61: 计算机科学与技术学院
A62: 61 | B62: 2 | C62: 0612102102 | D62: 陈东东 | F62: 信科0602 | G62: 理学院
A63: 62 | B63: 2 | C63: 0812105608 | D63: 张书豪 | F63: 理本0834 | G63: 一年级工作部
A64: 63 | B64: 2 | C64: 0712205068 | D64: 阚玉艳 | F64: 车辆0702 | G64: 交通与车辆工程学院
A65: 64 | B65: 2 | C65: 0612102992 | D65: 祝祥飞 | F65: 信科0602 | G65: 理学院
A66: 65 | B66: 2 | C66: 0712103739 | D66: 张纪宝 | F66: 热能0703 | G66: 交通与车辆工程学院
A67: 66 | B67: 2 | C67: 0712106457 | D67: 张赛龙 | F67: 计科0702 | G67: 计算机科学与技术学院
A68: 67 | B68: 2 | C68: 0712104606 | D68: 霍艳超 | F68: 机设0702 | G68: 机械工程学院
A69: 68 | B69: 2 | C69: 0612104722 | D69: 单发启 | F69: 信科0602 | G69: 理学院
A70: 69 | B70: 2 | C70: 0712102808 | D70: 翟锡杰 | F70: 机设0701 | G70: 机械工程学院
A71: 70 | B71: 2 | C71: 0712100185 | D71: 白银来 | F71: 机电0702 | G71: 机械工程学院
A72: 71 | B72: 2 | C72: 0712104326 | D72: 郭本领 | F72: 物理0701 | G72: 理学院
A73: 72 | B73: 2 | C73: 0712104811 | D73: 钱占松 | F73: 机电0702 | G73: 机械工程学院
A74: 73 | B74: 2 | C74: 0712103253 | D74: 董元甲 | F74: 车辆0701 | G74: 交通与车辆工程学院
A75: 74 | B75: 2 | C75: 0712104848 | D75: 刘玉康 | F75: 计科0701 | G75: 计算机科学与技术学院
A76: 75 | B76: 2 | C76: 0712103018 | D76: 冀方冉 | F76: 材料0702 | G76: 机械工程学院
A77: 76 | B77: 2 | C77: 0712103017 | D77: 张凡成 | F77: 机电0701 | G77: 机械工程学院
A78: 77 | B78: 2 | C78: 0712103916 | D78: 刘云雷 | F78: 计科0701 | G78: 计算机科学与技术学院
A79: 78 | B79: 2 | C79: 0712201942 | D79: 段文军 | F79: 车辆0704 | G79: 交通与车辆工程学院
A80: 79 | B80: 2 | C80: 0732107794 | D80: 郭世玉 | F80: 工造0701 | G80: 建筑工程学院
A81: 80 | B81: 2 | C81: 0712104917 | D81: 徐红宾 | F81: 车辆0704 | G81: 交通与车辆工程学院
A82: 81 | B82: 2 | C82: 0712104082 | D82: 李修城 | F82: 交运0701 | G82: 交通与车辆工程学院
A83: 82 | B83: 2 | C83: 0712203115 | D83: 马广青 | F83: 车辆0701 | G83: 交通与车辆工程学院
A84: 83 | B84: 2 | C84: 0712104885 | D84: 张振亮 | F84: 车辆0704 | G84: 交通与车辆工程学院
A85: 84 | B85: 2 | C85: 0712100174 | D85: 韩奎 | F85: 机制0705 | G85: 机械工程学院
A86: 85 | B86: 2 | C86: 0712104173 | D86: 牛腾飞 | F86: 机设0701 | G86: 机械工程学院
A87: 86 | B87: 2 | C87: 0712104729 | D87: 郝福辉 | F87: 机制0705 | G87: 机械工程学院
A88: 87 | B88: 2 | C88: 0712103280 | D88: 马文涛 | F88: 车辆0702 | G88: 交通与车辆工程学院
A89: 88 | B89: 2 | C89: 0712103010 | D89: 韩坤 | F89: 车辆0704 | G89: 交通与车辆工程学院
A93: 山东理工大学首届ACM程序设计竞赛最佳女生奖获奖名单
A94: 组内排名 | B94: 总排名 | C94: 做题数 | D94: 学号 | E94: 姓名 | F94: 班级 | G94: 学院
A95: 1 | B95: 15 | C95: 4 | D95: 0612204126 | E95: 徐慧慧 | F95: 信科0601 | G95: 理学院
A96: 2 | B96: 23 | C96: 4 | D96: 0612200025 | E96: 李小娜 | F96: 信科0602 | G96: 理学院
A99: 山东理工大学首届ACM程序设计竞赛最佳新人奖获奖名单
A100: 组内排名 | B100: 总排名 | C100: 做题数 | D100: 学号 | E100: 姓名 | F100: 班级 | G100: 学院
A101: 1 | B101: 14 | C101: 4 | D101: 0812106205 | E101: 李亚舟 | F101: 理本08103 | G101: 一年级工作部
A102: 1 | B102: 19 | C102: 4 | D102: 0812102554 | E102: 陈强 | F102: 理本0832 | G102: 一年级工作部
A108: 获奖情况说明统计表
A109: 参赛用人数563人，网络测试赛，现场测试赛、网络复活赛、现场决赛四场，进入决赛262人。
B112: 总数262人 比例 人数
B113: 一等奖 | C113: 0.029999999999999999 | D113: =262*C113 -> 7.8599999999999994
B114: 二等奖 | C114: 0.059999999999999998 | D114: =262*C114 -> 15.719999999999999
B115: 三等奖 | C115: 0.073999999999999996 | D115: =262*C115 -> 19.387999999999998
B116: 合计 | C116: 前3等奖 16% | D116: =SUM(D113:D115) -> 42.967999999999996
B117: 优胜奖 | D117: 45
B118: 合计 | C118: 含优胜奖 | D118: =SUM(D116:D117) -> 87.967999999999989
B123: 最佳女生奖 | D123: 2
B124: 最佳新人奖 | D124: 2
B126: 获奖证书总数 | D126: 92张